{"catalogue_last_updated":"2026-08-21","catalogue_schema_version":"0.1.0","limitations":["A catalogue match is not evidence of completeness, representativeness, transportability or analytical sufficiency.","Access conditions and licences require source-specific verification."],"map_type":"domain_access_capability","rows":[{"access_tested_source_ids":[],"acquisition_tested_source_ids":[],"candidate_source_ids":["un-world-population-prospects","world-bank-indicators-api"],"country_specific_validation_required":true,"domain":"population","label":"Population denominators","matching_source_ids":["un-world-population-prospects","world-bank-indicators-api"],"metadata_only_source_ids":["un-world-population-prospects","world-bank-indicators-api"],"need_id":"population","operational_readiness":"metadata_reviewed","rationale":"2 of 2 domain-matched source(s) satisfy the declared catalogue constraints. Access and test status do not establish fitness, completeness or representativeness.","required_analytic_role":null,"required_data_levels":[],"required_geographic_level":null,"scope":"Global and country","status":"public_open","sufficiency":"not_assessed","unresolved_questions":[]},{"access_tested_source_ids":[],"acquisition_tested_source_ids":[],"candidate_source_ids":["ihme-gbd-results","who-global-health-estimates"],"country_specific_validation_required":true,"domain":"mortality","label":"Mortality envelopes","matching_source_ids":["ihme-gbd-results","who-global-health-estimates"],"metadata_only_source_ids":["ihme-gbd-results","who-global-health-estimates"],"need_id":"mortality","operational_readiness":"metadata_reviewed","rationale":"2 of 2 domain-matched source(s) satisfy the declared catalogue constraints. Access and test status do not establish fitness, completeness or representativeness.","required_analytic_role":null,"required_data_levels":[],"required_geographic_level":null,"scope":"Global and country","status":"public_open","sufficiency":"not_assessed","unresolved_questions":[]},{"access_tested_source_ids":[],"acquisition_tested_source_ids":[],"candidate_source_ids":["ihme-gbd-results","who-global-health-estimates"],"country_specific_validation_required":true,"domain":"health_burden","label":"Health-loss envelopes","matching_source_ids":["ihme-gbd-results","who-global-health-estimates"],"metadata_only_source_ids":["ihme-gbd-results","who-global-health-estimates"],"need_id":"health-loss","operational_readiness":"metadata_reviewed","rationale":"2 of 2 domain-matched source(s) satisfy the declared catalogue constraints. Access and test status do not establish fitness, completeness or representativeness.","required_analytic_role":null,"required_data_levels":[],"required_geographic_level":null,"scope":"Global and country","status":"public_open","sufficiency":"not_assessed","unresolved_questions":[]},{"access_tested_source_ids":[],"acquisition_tested_source_ids":[],"candidate_source_ids":["all-of-us-public-tier","all-of-us-researcher-workbench","genomics-england-research-environment"],"country_specific_validation_required":true,"domain":"electronic_health_record","label":"Individual healthcare utilisation","matching_source_ids":["all-of-us-researcher-workbench","genomics-england-research-environment"],"metadata_only_source_ids":["all-of-us-researcher-workbench","genomics-england-research-environment"],"need_id":"utilisation","operational_readiness":"metadata_reviewed","rationale":"2 of 3 domain-matched source(s) satisfy the declared catalogue constraints. Access and test status do not establish fitness, completeness or representativeness.","required_analytic_role":null,"required_data_levels":["individual_level"],"required_geographic_level":null,"scope":"Country or cohort","status":"controlled_access_required","sufficiency":"not_assessed","unresolved_questions":[]},{"access_tested_source_ids":[],"acquisition_tested_source_ids":[],"candidate_source_ids":["mondo-disease-ontology","orphadata-science","umls-metathesaurus"],"country_specific_validation_required":true,"domain":"ontology","label":"Rare-disease semantic definitions","matching_source_ids":["mondo-disease-ontology","orphadata-science","umls-metathesaurus"],"metadata_only_source_ids":["mondo-disease-ontology","orphadata-science","umls-metathesaurus"],"need_id":"semantic","operational_readiness":"metadata_reviewed","rationale":"3 of 3 domain-matched source(s) satisfy the declared catalogue constraints. Access and test status do not establish fitness, completeness or representativeness.","required_analytic_role":null,"required_data_levels":[],"required_geographic_level":null,"scope":"Global","status":"public_open","sufficiency":"not_assessed","unresolved_questions":[]},{"access_tested_source_ids":[],"acquisition_tested_source_ids":[],"candidate_source_ids":[],"country_specific_validation_required":true,"domain":"economic_social","label":"Household economic and social burden","matching_source_ids":[],"metadata_only_source_ids":[],"need_id":"economic-social","operational_readiness":"unavailable","rationale":"No active source in the current catalogue is tagged for this domain.","required_analytic_role":null,"required_data_levels":[],"required_geographic_level":null,"scope":"Country and patient/family","status":"unavailable","sufficiency":"not_assessed","unresolved_questions":[]}],"schema_version":"1.0.0","summary":{"access_status_counts":{"controlled_access_required":1,"public_open":4,"unavailable":1},"need_count":6,"readiness_counts":{"metadata_reviewed":5,"unavailable":1}},"title":"RareBurden public-data capability and evidence-gap map"}
